{
  "$schema": "https://json-schema.org/draft/2020-12/schema",
  "$id": "https://schemas.holobike.local/HolobikeDeployment/Tool/src/holobike/schemas/record.schema.json",
  "title": "Run record",
  "description": "What one Assembler run resolved and attested. The shape follows the run-record idiom this ecosystem already proved (a run block with timing, a source-identity block, per-subject facts) hardened with provenance vocabulary: 'revision' is a full git commit id and corresponds to SLSA's digest.gitCommit; the deployment block is the record's self-identity, because a resolution that cannot identify itself is not provenance. Records are written by runs into the untracked Artifacts/ directory and are never edited; admission copies a record into Releases/, it does not rewrite one.",
  "type": "object",
  "additionalProperties": false,
  "required": [
    "schema_version",
    "kind",
    "run",
    "deployment",
    "line",
    "problems"
  ],
  "allOf": [
    {
      "if": {
        "properties": {
          "kind": {
            "const": "resolution"
          }
        }
      },
      "then": {
        "required": [
          "resolved"
        ],
        "properties": {
          "run": {
            "properties": {
              "verb": {
                "const": "resolve"
              }
            }
          },
          "actions": false,
          "profile": false,
          "builds": false,
          "artifacts": false,
          "resolution": false,
          "bundle": false,
          "assembly": false,
          "members": false,
          "deployables": false
        }
      }
    },
    {
      "if": {
        "properties": {
          "kind": {
            "const": "bootstrap"
          }
        }
      },
      "then": {
        "required": [
          "actions"
        ],
        "properties": {
          "run": {
            "properties": {
              "verb": {
                "const": "bootstrap"
              }
            }
          },
          "resolved": false,
          "profile": false,
          "builds": false,
          "artifacts": false,
          "resolution": false,
          "bundle": false,
          "assembly": false,
          "members": false,
          "deployables": false
        }
      }
    },
    {
      "if": {
        "properties": {
          "kind": {
            "const": "assembly"
          }
        }
      },
      "then": {
        "required": [
          "profile",
          "deployables",
          "resolution",
          "builds",
          "artifacts",
          "bundle"
        ],
        "properties": {
          "run": {
            "properties": {
              "verb": {
                "const": "assemble"
              }
            }
          },
          "resolved": false,
          "actions": false,
          "assembly": false,
          "members": false
        }
      }
    },
    {
      "if": {
        "properties": {
          "kind": {
            "const": "emulation"
          }
        }
      },
      "then": {
        "required": [
          "profile",
          "deployables",
          "assembly",
          "members"
        ],
        "properties": {
          "run": {
            "properties": {
              "verb": {
                "const": "emulate"
              }
            }
          },
          "resolved": false,
          "actions": false,
          "resolution": false,
          "builds": false,
          "artifacts": false,
          "bundle": false,
          "version": false,
          "chain": false,
          "attestation": false
        }
      }
    },
    {
      "if": {
        "properties": {
          "kind": {
            "const": "release"
          }
        }
      },
      "then": {
        "required": [
          "version",
          "profile",
          "deployables",
          "chain",
          "attestation"
        ],
        "properties": {
          "run": {
            "properties": {
              "verb": {
                "const": "admit"
              }
            }
          },
          "resolved": false,
          "actions": false,
          "resolution": false,
          "builds": false,
          "artifacts": false,
          "bundle": false,
          "assembly": false,
          "members": false
        }
      }
    }
  ],
  "properties": {
    "schema_version": {
      "const": 4
    },
    "kind": {
      "enum": [
        "resolution",
        "bootstrap",
        "assembly",
        "emulation",
        "release"
      ]
    },
    "run": {
      "type": "object",
      "additionalProperties": false,
      "required": [
        "verb",
        "host",
        "os",
        "started_at_utc",
        "finished_at_utc"
      ],
      "properties": {
        "verb": {
          "enum": [
            "resolve",
            "bootstrap",
            "assemble",
            "emulate",
            "admit"
          ]
        },
        "host": {
          "type": "string",
          "minLength": 1,
          "pattern": "^[A-Za-z0-9][A-Za-z0-9._-]*$"
        },
        "os": {
          "enum": [
            "linux",
            "windows"
          ]
        },
        "started_at_utc": {
          "type": "string",
          "minLength": 1,
          "pattern": "Z$"
        },
        "finished_at_utc": {
          "type": "string",
          "minLength": 1,
          "pattern": "Z$"
        }
      },
      "description": "Which verb ran, on which machine, and when. A record that does not name its producer cannot be told apart from one made elsewhere \u2014 and the panel host produces the records only it can."
    },
    "deployment": {
      "type": "object",
      "additionalProperties": false,
      "required": [
        "revision",
        "dirty"
      ],
      "properties": {
        "revision": {
          "type": "string",
          "pattern": "^[0-9a-f]{40}$"
        },
        "dirty": {
          "type": "boolean"
        }
      }
    },
    "line": {
      "type": "string",
      "minLength": 1
    },
    "resolved": {
      "type": "object",
      "minProperties": 1,
      "additionalProperties": false,
      "properties": {
        "uroborOS": {
          "$ref": "#/$defs/resolution"
        },
        "HexAtlas": {
          "$ref": "#/$defs/resolution"
        },
        "Assetscape": {
          "$ref": "#/$defs/resolution"
        },
        "HolobikeCore": {
          "$ref": "#/$defs/resolution"
        },
        "AthleteIdentity": {
          "$ref": "#/$defs/resolution"
        },
        "AthleteInsights": {
          "$ref": "#/$defs/resolution"
        },
        "drAIs": {
          "$ref": "#/$defs/resolution"
        },
        "HolobikeExperience": {
          "$ref": "#/$defs/resolution"
        },
        "HolobikeDevice": {
          "$ref": "#/$defs/resolution"
        },
        "HolobikeRider": {
          "$ref": "#/$defs/resolution"
        },
        "HolobikeWorlds": {
          "$ref": "#/$defs/resolution"
        },
        "HoloviewDisplay": {
          "$ref": "#/$defs/resolution"
        },
        "OrielUI": {
          "$ref": "#/$defs/resolution"
        }
      }
    },
    "actions": {
      "type": "object",
      "description": "bootstrap records only: what materialization did per integration. Bounded mutations exclusively \u2014 clone missing, fast-forward clean-on-branch; everything else is a reported status, never a reset.",
      "minProperties": 1,
      "additionalProperties": false,
      "properties": {
        "uroborOS": {
          "$ref": "#/$defs/action"
        },
        "HexAtlas": {
          "$ref": "#/$defs/action"
        },
        "Assetscape": {
          "$ref": "#/$defs/action"
        },
        "HolobikeCore": {
          "$ref": "#/$defs/action"
        },
        "AthleteIdentity": {
          "$ref": "#/$defs/action"
        },
        "AthleteInsights": {
          "$ref": "#/$defs/action"
        },
        "drAIs": {
          "$ref": "#/$defs/action"
        },
        "HolobikeExperience": {
          "$ref": "#/$defs/action"
        },
        "HolobikeDevice": {
          "$ref": "#/$defs/action"
        },
        "HolobikeRider": {
          "$ref": "#/$defs/action"
        },
        "HolobikeWorlds": {
          "$ref": "#/$defs/action"
        },
        "HoloviewDisplay": {
          "$ref": "#/$defs/action"
        },
        "OrielUI": {
          "$ref": "#/$defs/action"
        }
      }
    },
    "profile": {
      "type": "string",
      "minLength": 1,
      "pattern": "^[a-z0-9][a-z0-9-]*$"
    },
    "resolution": {
      "type": "object",
      "additionalProperties": false,
      "required": [
        "record",
        "sha256",
        "line"
      ],
      "description": "assembly records only: the resolution this bundle was built from \u2014 a bundle that cannot say what it was built from is not provenance.",
      "properties": {
        "record": {
          "$ref": "#/$defs/record_name"
        },
        "sha256": {
          "$ref": "#/$defs/sha256"
        },
        "line": {
          "type": "string",
          "minLength": 1
        }
      }
    },
    "builds": {
      "type": "object",
      "minProperties": 1,
      "propertyNames": {
        "pattern": "^[A-Za-z][A-Za-z0-9]*\\.[A-Za-z][A-Za-z0-9]*$"
      },
      "additionalProperties": {
        "$ref": "#/$defs/build_result"
      }
    },
    "artifacts": {
      "type": "object",
      "propertyNames": {
        "pattern": "^[A-Za-z][A-Za-z0-9]*\\.[A-Za-z][A-Za-z0-9]*$"
      },
      "additionalProperties": {
        "type": "array",
        "items": {
          "$ref": "#/$defs/staged_artifact"
        }
      }
    },
    "bundle": {
      "$ref": "#/$defs/relative_path",
      "description": "assembly records only: the bundle directory this run staged, relative to the artifacts root."
    },
    "assembly": {
      "type": "object",
      "additionalProperties": false,
      "required": [
        "record",
        "sha256",
        "bundle"
      ],
      "description": "emulation records only: the assembly this run executed \u2014 the chain reads emulation \u2192 assembly \u2192 resolution \u2192 declaration, and no step can lie about its parent.",
      "properties": {
        "record": {
          "$ref": "#/$defs/record_name"
        },
        "sha256": {
          "$ref": "#/$defs/sha256"
        },
        "bundle": {
          "$ref": "#/$defs/relative_path"
        }
      }
    },
    "members": {
      "type": "object",
      "minProperties": 1,
      "propertyNames": {
        "pattern": "^[A-Za-z][A-Za-z0-9]*\\.[A-Za-z][A-Za-z0-9]*$"
      },
      "additionalProperties": {
        "$ref": "#/$defs/member"
      }
    },
    "version": {
      "type": "string",
      "minLength": 1,
      "pattern": "^[a-z0-9][a-z0-9.-]*$",
      "description": "release records only: the admitted version, also the Releases/<version>/ directory name."
    },
    "chain": {
      "type": "object",
      "additionalProperties": false,
      "required": [
        "resolution",
        "assembly",
        "emulation"
      ],
      "description": "release records only: the records this release was admitted from, copied into the release directory so it references nothing ephemeral. emulation is null when the release was admitted un-emulated.",
      "properties": {
        "resolution": {
          "$ref": "#/$defs/record_reference"
        },
        "assembly": {
          "$ref": "#/$defs/record_reference"
        },
        "emulation": {
          "oneOf": [
            {
              "$ref": "#/$defs/record_reference"
            },
            {
              "type": "null"
            }
          ]
        }
      }
    },
    "attestation": {
      "type": "object",
      "additionalProperties": false,
      "required": [
        "builds",
        "selections",
        "emulation"
      ],
      "description": "release records only: what admission verified. An admitted release attests pass on gates, builds, and selections; emulation is healthy or honestly absent.",
      "properties": {
        "builds": {
          "const": "pass"
        },
        "selections": {
          "const": "pass"
        },
        "emulation": {
          "enum": [
            "healthy",
            "absent"
          ]
        }
      }
    },
    "problems": {
      "type": "array",
      "items": {
        "type": "string",
        "minLength": 1
      }
    },
    "deployables": {
      "type": "array",
      "minItems": 1,
      "uniqueItems": true,
      "items": {
        "type": "string",
        "pattern": "^[A-Za-z][A-Za-z0-9]*\\.[A-Za-z][A-Za-z0-9]*$"
      },
      "description": "The deployables this record is about, as Integration.Deployable. A repository may contribute more than one \u2014 the server tier is where that first became real \u2014 so naming the repository would describe less than the run did."
    }
  },
  "$defs": {
    "member": {
      "type": "object",
      "additionalProperties": false,
      "required": [
        "status",
        "run"
      ],
      "properties": {
        "status": {
          "enum": [
            "healthy",
            "skipped",
            "spawn_failed",
            "exited_early",
            "never_ready",
            "failed_settle",
            "unclean_shutdown"
          ]
        },
        "run": {
          "enum": [
            "host"
          ]
        },
        "serve": {
          "type": "object",
          "additionalProperties": false,
          "required": [
            "argv"
          ],
          "properties": {
            "argv": {
              "type": "array",
              "minItems": 1,
              "items": {
                "type": "string",
                "minLength": 1
              }
            },
            "env": {
              "type": "object",
              "propertyNames": {
                "minLength": 1
              },
              "additionalProperties": {
                "type": "string"
              }
            }
          }
        },
        "probe": {
          "type": "object",
          "additionalProperties": false,
          "required": [
            "attempts"
          ],
          "properties": {
            "attempts": {
              "type": "integer",
              "minimum": 0
            },
            "ready_after_ms": {
              "type": "integer",
              "minimum": 0
            }
          }
        },
        "log": {
          "$ref": "#/$defs/relative_path"
        },
        "shutdown": {
          "type": "object",
          "additionalProperties": false,
          "required": [
            "clean"
          ],
          "properties": {
            "clean": {
              "type": "boolean"
            },
            "detail": {
              "type": "string",
              "minLength": 1
            }
          }
        },
        "detail": {
          "type": "string",
          "minLength": 1
        }
      }
    },
    "build_result": {
      "type": "object",
      "additionalProperties": false,
      "required": [
        "status",
        "steps"
      ],
      "properties": {
        "status": {
          "enum": [
            "built",
            "failed",
            "skipped",
            "invalidated",
            "unavailable"
          ]
        },
        "steps": {
          "type": "array",
          "items": {
            "type": "object",
            "additionalProperties": false,
            "required": [
              "argv",
              "exit",
              "log"
            ],
            "properties": {
              "argv": {
                "type": "array",
                "minItems": 1,
                "items": {
                  "type": "string",
                  "minLength": 1
                }
              },
              "exit": {
                "type": "integer"
              },
              "log": {
                "$ref": "#/$defs/relative_path"
              }
            }
          }
        },
        "detail": {
          "type": "string",
          "minLength": 1
        }
      }
    },
    "staged_artifact": {
      "type": "object",
      "additionalProperties": false,
      "required": [
        "path",
        "sha256",
        "bytes"
      ],
      "properties": {
        "path": {
          "$ref": "#/$defs/relative_path"
        },
        "sha256": {
          "$ref": "#/$defs/sha256"
        },
        "bytes": {
          "type": "integer",
          "minimum": 0
        }
      }
    },
    "action": {
      "type": "object",
      "additionalProperties": false,
      "required": [
        "status"
      ],
      "properties": {
        "status": {
          "enum": [
            "cloned",
            "clone_failed",
            "updated",
            "up_to_date",
            "matched",
            "dirty_skipped",
            "selection_mismatch",
            "diverged",
            "fetch_failed",
            "unclonable",
            "unreadable_repository"
          ]
        },
        "detail": {
          "type": "string",
          "minLength": 1
        },
        "revision_before": {
          "type": "string"
        },
        "revision_after": {
          "type": "string"
        }
      }
    },
    "record_name": {
      "type": "string",
      "pattern": "^[A-Za-z0-9][A-Za-z0-9._-]*\\.json$"
    },
    "relative_path": {
      "type": "string",
      "pattern": "^(?!/)(?!.*(?:^|/)\\.\\.(?:/|$))(?!.*//)(?!.*(?:^|/)\\.(?:/|$))(?!.*\\u0000)(?!.*/$).+$"
    },
    "sha256": {
      "type": "string",
      "pattern": "^[0-9a-f]{64}$"
    },
    "record_reference": {
      "type": "object",
      "additionalProperties": false,
      "required": [
        "record",
        "sha256"
      ],
      "properties": {
        "record": {
          "$ref": "#/$defs/record_name"
        },
        "sha256": {
          "$ref": "#/$defs/sha256"
        }
      }
    },
    "resolution": {
      "type": "object",
      "additionalProperties": false,
      "required": [
        "selected",
        "status"
      ],
      "properties": {
        "selected": {
          "type": "object",
          "additionalProperties": false,
          "minProperties": 1,
          "maxProperties": 1,
          "properties": {
            "branch": {
              "type": "string",
              "minLength": 1
            },
            "commit": {
              "type": "string",
              "pattern": "^[0-9a-f]{40}$"
            }
          }
        },
        "status": {
          "enum": [
            "resolved",
            "selection_mismatch",
            "unresolvable"
          ]
        },
        "revision": {
          "type": "string",
          "pattern": "^[0-9a-f]{40}$"
        },
        "branch": {
          "type": "string"
        },
        "dirty": {
          "type": "boolean"
        },
        "detail": {
          "type": "string",
          "minLength": 1
        }
      }
    }
  }
}
