{
  "schema_version": 4,
  "kind": "assembly",
  "run": {
    "verb": "assemble",
    "started_at_utc": "2026-08-04T12:00:00Z",
    "finished_at_utc": "2026-08-04T12:03:00Z",
    "host": "workstation",
    "os": "linux"
  },
  "deployment": {
    "revision": "a652f43a652f43a652f43a652f43a652f43a6520",
    "dirty": false
  },
  "line": "dev",
  "profile": "services",
  "resolution": {
    "record": "resolve-dev-20260804T120000000000Z.json",
    "sha256": "0000000000000000000000000000000000000000000000000000000000000000",
    "line": "dev"
  },
  "builds": {
    "AthleteIdentity.IdentityClient": {
      "status": "unavailable",
      "detail": "docker: No such file or directory",
      "steps": [
        {
          "argv": [
            "docker",
            "build",
            "."
          ],
          "exit": -1,
          "log": "logs/step0.log"
        }
      ]
    },
    "HolobikeCore.HolobikeCore": {
      "status": "built",
      "steps": [
        {
          "argv": [
            "bash",
            "./holobikecore.sh",
            "package"
          ],
          "exit": 0,
          "log": "logs/HolobikeCore-step0.log"
        }
      ]
    }
  },
  "artifacts": {
    "AthleteIdentity.IdentityClient": [],
    "HolobikeCore.HolobikeCore": [
      {
        "path": "HolobikeCore.HolobikeCore/holobike-core-rootfs.tar",
        "sha256": "abcdef0123456789abcdef0123456789abcdef0123456789abcdef0123456789",
        "bytes": 7340032
      }
    ]
  },
  "problems": [
    "AthleteIdentity.IdentityClient: build step 0 could not run \u2014 docker is not available on this host"
  ],
  "bundle": "bundles/services-20260804T120000000000Z",
  "deployables": [
    "AthleteIdentity.IdentityClient",
    "HolobikeCore.HolobikeCore"
  ]
}
