{
  "schema_version": 4,
  "kind": "resolution",
  "run": {
    "verb": "resolve",
    "started_at_utc": "2026-08-04T12:00:00Z",
    "finished_at_utc": "2026-08-04T12:00:01Z",
    "host": "workstation",
    "os": "linux"
  },
  "deployment": {
    "revision": "a652f43a652f43a652f43a652f43a652f43a6520",
    "dirty": false
  },
  "line": "dev",
  "resolved": {
    "HexAtlas": {
      "selected": {
        "branch": "main"
      },
      "status": "resolved",
      "revision": "0123456789abcdef0123456789abcdef01234567",
      "branch": "main",
      "dirty": false
    }
  },
  "problems": []
}
